{
  "kind": "concept",
  "id": "molarity",
  "title": "Molarity",
  "term": "molarity",
  "definition": "Concentration as amount of solute per litre of solution: $M = n/V$, in mol/L. It is the bridge from something you can measure — a volume — to moles: multiply a volume in litres by a molarity and the litres cancel, leaving the moles that feed the ledger.",
  "related": [
    {
      "to": "molar-mass",
      "type": "sibling-conversion"
    },
    {
      "to": "limiting-reagent",
      "type": "prerequisite-for"
    }
  ],
  "lessons": [
    "calcium-carbonate-limiting",
    "calcium-phosphate-limiting"
  ],
  "regime": "ledger-exact",
  "latex": "M = \\dfrac{n}{V}"
}
