{
  "kind": "concept",
  "id": "solubility-product",
  "title": "Solubility product (Ksp) and molar solubility",
  "term": "solubility product",
  "definition": "For a sparingly soluble salt at saturation, $\\mathrm{M}_a\\mathrm{X}_b(s) \\rightleftharpoons a\\,\\mathrm{M}^{n+} + b\\,\\mathrm{X}^{m-}$, the **solubility product** is $K_{sp} = [\\mathrm{M}^{n+}]^a[\\mathrm{X}^{m-}]^b$. The dissolving solid is a **pure phase** (activity 1), so it does **not** appear — that exclusion is the whole move. The equilibrium's extent is the **molar solubility** $s$ (mol dissolved per litre): $[\\mathrm{M}^{n+}] = a s$, $[\\mathrm{X}^{m-}] = b s$, so $K_{sp} = (a s)^a (b s)^b$ — a polynomial in $s$ (a **cubic** for a 1:2 salt), solved for $s$. A smaller $K_{sp}$ means less dissolves, but $K_{sp}$ values compare solubility directly only for salts of the **same** ion ratio. Comparing $K_{sp}$ to the reaction quotient $Q$ predicts precipitation: $Q > K_{sp}$ means a solid forms (the Phase-0 precipitation rules, quantified).",
  "related": [
    {
      "to": "chemical-equilibrium",
      "type": "instance-of"
    },
    {
      "to": "common-ion-effect",
      "type": "see-also"
    },
    {
      "to": "reaction-quotient",
      "type": "see-also"
    },
    {
      "to": "precipitation",
      "type": "quantifies"
    },
    {
      "to": "solubility-rules",
      "type": "quantifies"
    },
    {
      "to": "extent-of-reaction",
      "type": "extends"
    }
  ],
  "lessons": [
    "calcium-fluoride-solubility",
    "calcium-fluoride-common-ion",
    "calcium-fluoride-precipitation"
  ],
  "regime": "model-exact",
  "latex": "K_{sp} = [\\mathrm{M}^{n+}]^a\\,[\\mathrm{X}^{m-}]^b"
}
