{
  "kind": "concept",
  "id": "periodic-trends",
  "title": "Periodic trends",
  "term": "periodic trend",
  "definition": "A property that varies systematically with position on the periodic table: covalent radius shrinks left → right and grows top → bottom; first ionization energy and electronegativity do the opposite. The usual explanation is effective nuclear charge — across a period, protons are added while electrons enter the same shell, pulling everything tighter; down a group, each row adds a screened outer shell. That story is useful and widely taught, but it is an interpretation laid over measured data, and the data keeps exceptions the slogan hides (boron ionizes below beryllium, oxygen below nitrogen). On the Valence Table the trend lenses color the sourced values; the pattern panels tell the story and name its exceptions.",
  "related": [
    {
      "to": "ionization-energy",
      "type": "explains"
    },
    {
      "to": "electronegativity",
      "type": "explains"
    },
    {
      "to": "nomenclature",
      "type": "supports"
    }
  ],
  "lessons": [],
  "regime": "mechanistic"
}
